{
  "receiptVersion": "atg.execution-receipt.local.v1",
  "receiptId": "execution_receipt_89907ed4bb43877b45f49ad7",
  "gatePassId": "gatepass_exact_da44e28cb73ed53b5aef8c75",
  "actionDigest": "sha256:b13ebb44ee63b898c59e5c8290002698200f54cc4e0c3d0b6ef51eeede9a880a",
  "nonce": "nonce_exact_action_amount",
  "verifierIdentity": "local_point_of_action_verifier",
  "verificationTimestamp": "2026-07-20T09:05:00.000Z",
  "executionAcknowledgementTimestamp": null,
  "resultStatus": "action_mismatch",
  "reasonCode": "GATEPASS_ACTION_DIGEST_MISMATCH",
  "reasonCodes": [
    "GATEPASS_ACTION_DIGEST_MISMATCH"
  ],
  "simulatedSideEffectReference": null,
  "decisionReceiptReference": "decision_receipt_03a8db731184b77b70773439",
  "safeFailureDetail": "Execution was refused locally before the simulated side effect: GATEPASS_ACTION_DIGEST_MISMATCH.",
  "verification": {
    "resultVersion": "atg.exact-action-verification.local.v1",
    "gatePassId": "gatepass_exact_da44e28cb73ed53b5aef8c75",
    "actionDigest": "sha256:b13ebb44ee63b898c59e5c8290002698200f54cc4e0c3d0b6ef51eeede9a880a",
    "proposedActionDigest": "sha256:d99c3ce9db52b9462b3a4fd0ce37dba4a00fd615fa3ecc5944962d8602550fbd",
    "verifierIdentity": "local_point_of_action_verifier",
    "verificationProfile": "local_exact_action_verification_profile",
    "verificationTimestamp": "2026-07-20T09:05:00.000Z",
    "verified": false,
    "nonceConsumed": false,
    "signatureValid": true,
    "keyStatus": "active",
    "nonceState": {
      "stateVersion": "atg.nonce-state.local.v1",
      "nonce": "nonce_exact_action_amount",
      "gatePassId": "gatepass_exact_da44e28cb73ed53b5aef8c75",
      "actionDigest": "sha256:b13ebb44ee63b898c59e5c8290002698200f54cc4e0c3d0b6ef51eeede9a880a",
      "expiresAt": "2026-07-20T09:10:00.000Z",
      "status": "unused",
      "updatedAt": "2026-07-20T09:00:00.000Z",
      "transitions": [
        {
          "from": null,
          "to": "unused",
          "at": "2026-07-20T09:00:00.000Z",
          "reasonCode": "NONCE_REGISTERED"
        }
      ],
      "localProcessOnly": true,
      "crossProcessAtomicity": false
    },
    "reasonCodes": [
      "GATEPASS_ACTION_DIGEST_MISMATCH"
    ],
    "localOnly": true,
    "simulatedActionsOnly": true,
    "note": "Allowed does not mean executed."
  },
  "simulatedOnly": true,
  "externalActionOccurred": false,
  "allowedDoesNotMeanExecuted": true
}
