{
  "receiptVersion": "atg.execution-receipt.local.v1",
  "receiptId": "execution_receipt_ff9bc2b208b812202ddf5880",
  "gatePassId": "gatepass_exact_4d2c7b9c4d6fc1800dbfbca6",
  "actionDigest": "sha256:748178af74c0f9eeeb8865a9d8cc1afc34ff64479b75285f11fddd3004415de1",
  "nonce": "nonce_exact_action_001",
  "verifierIdentity": "local_point_of_action_verifier",
  "verificationTimestamp": "2026-07-20T09:05:00.000Z",
  "executionAcknowledgementTimestamp": null,
  "resultStatus": "replay_rejected",
  "reasonCode": "GATEPASS_ALREADY_CONSUMED",
  "reasonCodes": [
    "GATEPASS_ALREADY_CONSUMED"
  ],
  "simulatedSideEffectReference": null,
  "decisionReceiptReference": "decision_receipt_ad9431a7e52ecc5dc689adf2",
  "safeFailureDetail": "Execution was refused locally before the simulated side effect: GATEPASS_ALREADY_CONSUMED.",
  "verification": {
    "resultVersion": "atg.exact-action-verification.local.v1",
    "gatePassId": "gatepass_exact_4d2c7b9c4d6fc1800dbfbca6",
    "actionDigest": "sha256:748178af74c0f9eeeb8865a9d8cc1afc34ff64479b75285f11fddd3004415de1",
    "proposedActionDigest": "sha256:748178af74c0f9eeeb8865a9d8cc1afc34ff64479b75285f11fddd3004415de1",
    "verifierIdentity": "local_point_of_action_verifier",
    "verificationProfile": "local_exact_action_verification_profile",
    "verificationTimestamp": "2026-07-20T09:05:00.000Z",
    "verified": false,
    "nonceConsumed": false,
    "signatureValid": true,
    "keyStatus": "active",
    "nonceState": {
      "stateVersion": "atg.nonce-state.local.v1",
      "nonce": "nonce_exact_action_001",
      "gatePassId": "gatepass_exact_4d2c7b9c4d6fc1800dbfbca6",
      "actionDigest": "sha256:748178af74c0f9eeeb8865a9d8cc1afc34ff64479b75285f11fddd3004415de1",
      "expiresAt": "2026-07-20T09:10:00.000Z",
      "status": "consumed",
      "updatedAt": "2026-07-20T09:05:00.000Z",
      "transitions": [
        {
          "from": null,
          "to": "unused",
          "at": "2026-07-20T09:00:00.000Z",
          "reasonCode": "NONCE_REGISTERED"
        },
        {
          "from": "unused",
          "to": "consumed",
          "at": "2026-07-20T09:05:00.000Z",
          "reasonCode": "NONCE_CONSUMED"
        }
      ],
      "localProcessOnly": true,
      "crossProcessAtomicity": false
    },
    "reasonCodes": [
      "GATEPASS_ALREADY_CONSUMED"
    ],
    "localOnly": true,
    "simulatedActionsOnly": true,
    "note": "Allowed does not mean executed."
  },
  "simulatedOnly": true,
  "externalActionOccurred": false,
  "allowedDoesNotMeanExecuted": true
}
